{
  "schemaVersion": 2,
  "toolVersion": "0.5.0",
  "generatedAt": "2026-06-30T00:00:00.000Z",
  "command": "pressure",
  "status": "ok",
  "redacted": true,
  "platform": "darwin",
  "totals": {
    "aiCpuPercent": 15.3,
    "aiCpuCapacityPercent": 1.9,
    "aiRssBytes": 1363148800,
    "aiProcessCount": 3,
    "otherCpuPercent": 42.5,
    "otherCpuCapacityPercent": 5.3,
    "otherRssBytes": 471859200,
    "otherProcessCount": 2,
    "processCount": 5,
    "logicalCpuCount": 8
  },
  "pressureLevel": {
    "overall": "medium",
    "cpu": "ok",
    "memory": "ok",
    "disk": "medium",
    "reasons": [
      "disk usage is elevated"
    ]
  },
  "memory": {
    "pageSizeBytes": 16384,
    "freeBytes": 3221225472,
    "freePercent": 30,
    "pagesFree": 786432,
    "pagesUsedByCompressor": 131072,
    "swapouts": 0
  },
  "disk": {
    "availableBytes": 52613349376,
    "capacityPercent": 80
  },
  "processes": [
    {
      "pid": 123,
      "ppid": 1,
      "provider": "codex",
      "category": "app",
      "displayName": "Codex",
      "cpuPercent": 10,
      "memoryPercent": 7.5,
      "rssBytes": 629145600,
      "commandSummary": "Codex.app"
    },
    {
      "pid": 456,
      "ppid": 1,
      "provider": "cursor",
      "category": "extension-host",
      "displayName": "Cursor ExtHost",
      "cpuPercent": 3.5,
      "memoryPercent": 4.2,
      "rssBytes": 524288000,
      "commandSummary": "Cursor Helper"
    },
    {
      "pid": 789,
      "ppid": 1,
      "provider": "claude-code",
      "category": "app",
      "displayName": "Claude",
      "cpuPercent": 1.8,
      "memoryPercent": 1.7,
      "rssBytes": 209715200,
      "commandSummary": "claude"
    },
    {
      "pid": 321,
      "ppid": 1,
      "provider": "other",
      "category": "browser",
      "displayName": "Chrome Helper",
      "cpuPercent": 35,
      "memoryPercent": 2.8,
      "rssBytes": 367001600,
      "commandSummary": "Google Chrome Helper"
    },
    {
      "pid": 654,
      "ppid": 1,
      "provider": "other",
      "category": "system",
      "displayName": "WindowServer",
      "cpuPercent": 7.5,
      "memoryPercent": 0.8,
      "rssBytes": 104857600,
      "commandSummary": "WindowServer"
    }
  ],
  "warnings": [],
  "nextActions": [
    "Close idle browser tabs or AI tool windows before restarting the Mac."
  ]
}
